{
  "$schema": "https://moe-ui.vercel.app/schema/registry-item.json",
  "schemaVersion": 1,
  "name": "accordion",
  "title": "Accordion",
  "description": "Vertically stacked, interactive headings that reveal content.",
  "category": "navigation",
  "type": "registry:ui",
  "files": [
    {
      "path": "components/ui/accordion.tsx",
      "target": "components/ui/accordion.tsx",
      "content": "import { Icon } from \"./icon\";\nimport { TextClassContext } from \"./text\";\nimport { cn } from \"../../lib/utils\";\nimport * as AccordionPrimitive from \"@rn-primitives/accordion\";\nimport { ChevronDown } from \"lucide-react-native\";\nimport { Platform, Pressable, View } from \"react-native\";\nimport Animated, {\n  FadeOutUp,\n  LayoutAnimationConfig,\n  LinearTransition,\n  useAnimatedStyle,\n  useDerivedValue,\n  withTiming,\n} from \"react-native-reanimated\";\n\nfunction Accordion({\n  children,\n  ...props\n}: Omit<AccordionPrimitive.RootProps, \"asChild\"> &\n  React.RefAttributes<AccordionPrimitive.RootRef>) {\n  return (\n    <LayoutAnimationConfig skipEntering>\n      <AccordionPrimitive.Root\n        {...(props as AccordionPrimitive.RootProps)}\n        asChild={Platform.OS !== \"web\"}\n      >\n        <Animated.View layout={LinearTransition.duration(200)}>\n          {children}\n        </Animated.View>\n      </AccordionPrimitive.Root>\n    </LayoutAnimationConfig>\n  );\n}\n\nfunction AccordionItem({\n  children,\n  className,\n  value,\n  ...props\n}: AccordionPrimitive.ItemProps &\n  React.RefAttributes<AccordionPrimitive.ItemRef>) {\n  return (\n    <AccordionPrimitive.Item\n      className={cn(\n        \"border-border border-b\",\n        Platform.select({ web: \"last:border-b-0\" }),\n        className,\n      )}\n      value={value}\n      asChild\n      {...props}\n    >\n      <Animated.View\n        className=\"native:overflow-hidden\"\n        layout={Platform.select({ native: LinearTransition.duration(200) })}\n      >\n        {children}\n      </Animated.View>\n    </AccordionPrimitive.Item>\n  );\n}\n\nconst Trigger = Platform.OS === \"web\" ? View : Pressable;\n\nfunction AccordionTrigger({\n  className,\n  children,\n  ...props\n}: AccordionPrimitive.TriggerProps & {\n  children?: React.ReactNode;\n} & React.RefAttributes<AccordionPrimitive.TriggerRef>) {\n  const { isExpanded } = AccordionPrimitive.useItemContext();\n\n  const progress = useDerivedValue(\n    () =>\n      isExpanded\n        ? withTiming(1, { duration: 250 })\n        : withTiming(0, { duration: 200 }),\n    [isExpanded],\n  );\n  const chevronStyle = useAnimatedStyle(\n    () => ({\n      transform: [{ rotate: `${progress.value * 180}deg` }],\n    }),\n    [progress],\n  );\n\n  return (\n    <TextClassContext.Provider\n      value={cn(\n        \"text-left text-sm font-medium\",\n        Platform.select({ web: \"group-hover:underline\" }),\n      )}\n    >\n      <AccordionPrimitive.Header>\n        <AccordionPrimitive.Trigger {...props} asChild={Platform.OS !== \"web\"}>\n          <Trigger\n            className={cn(\n              \"flex-row items-start justify-between gap-4 rounded-md py-4 disabled:opacity-50\",\n              Platform.select({\n                web: \"focus-visible:border-ring focus-visible:ring-ring/50 flex flex-1 outline-none transition-all hover:underline focus-visible:ring-[3px] disabled:pointer-events-none [&[data-state=open]>svg]:rotate-180\",\n              }),\n              className,\n            )}\n          >\n            <>{children}</>\n            <Animated.View style={chevronStyle}>\n              <Icon\n                as={ChevronDown}\n                size={16}\n                className={cn(\n                  \"text-muted-foreground shrink-0\",\n                  Platform.select({\n                    web: \"pointer-events-none translate-y-0.5 transition-transform duration-200\",\n                  }),\n                )}\n              />\n            </Animated.View>\n          </Trigger>\n        </AccordionPrimitive.Trigger>\n      </AccordionPrimitive.Header>\n    </TextClassContext.Provider>\n  );\n}\n\nfunction AccordionContent({\n  className,\n  children,\n  ...props\n}: AccordionPrimitive.ContentProps &\n  React.RefAttributes<AccordionPrimitive.ContentRef>) {\n  const { isExpanded } = AccordionPrimitive.useItemContext();\n  return (\n    <TextClassContext.Provider value=\"text-sm\">\n      <AccordionPrimitive.Content\n        className={cn(\n          \"overflow-hidden\",\n          Platform.select({\n            web: isExpanded ? \"animate-accordion-down\" : \"animate-accordion-up\",\n          }),\n        )}\n        {...props}\n      >\n        <Animated.View\n          exiting={Platform.select({ native: FadeOutUp.duration(200) })}\n          className={cn(\"pb-4\", className)}\n        >\n          {children}\n        </Animated.View>\n      </AccordionPrimitive.Content>\n    </TextClassContext.Provider>\n  );\n}\n\nexport { Accordion, AccordionContent, AccordionItem, AccordionTrigger };\n"
    }
  ],
  "dependencies": {
    "@rn-primitives/accordion": "1.5.2",
    "lucide-react-native": "0.563.0",
    "react-native": "0.83.1",
    "react-native-reanimated": "4.2.1"
  },
  "registryDependencies": [
    "icon",
    "text",
    "utils"
  ],
  "integrity": "sha256-6y+4FzuSFFORdKQVtsWdW7wziKCE6I2XF70djjeR5Ns="
}
