{
  "$schema": "https://moe-ui-docs.vercel.app/schema/registry-item.json",
  "schemaVersion": 1,
  "name": "tabs",
  "title": "Tabs",
  "description": "A keyboard-navigable set of layered content panels.",
  "category": "navigation",
  "type": "registry:ui",
  "files": [
    {
      "path": "components/ui/tabs.tsx",
      "target": "components/ui/tabs.tsx",
      "content": "\"use client\";\n\nimport { TextClassContext } from \"./text\";\nimport { cn } from \"../../lib/utils\";\nimport * as TabsPrimitive from \"@rn-primitives/tabs\";\nimport * as React from \"react\";\nimport { Platform } from \"react-native\";\n\nfunction Tabs({\n  className,\n  value: valueProp,\n  defaultValue,\n  onValueChange,\n  ...props\n}: Omit<TabsPrimitive.RootProps, \"value\" | \"onValueChange\"> &\n  React.RefAttributes<TabsPrimitive.RootRef> & {\n    value?: string;\n    defaultValue?: string;\n    onValueChange?: (value: string) => void;\n  }) {\n  const [uncontrolledValue, setUncontrolledValue] = React.useState(\n    defaultValue ?? \"\",\n  );\n  const value = valueProp ?? uncontrolledValue;\n  return (\n    <TabsPrimitive.Root\n      className={cn(\"flex flex-col gap-2\", className)}\n      value={value}\n      onValueChange={(nextValue) => {\n        if (valueProp === undefined) setUncontrolledValue(nextValue);\n        onValueChange?.(nextValue);\n      }}\n      {...props}\n    />\n  );\n}\n\nfunction TabsList({\n  className,\n  ...props\n}: TabsPrimitive.ListProps & React.RefAttributes<TabsPrimitive.ListRef>) {\n  return (\n    <TabsPrimitive.List\n      className={cn(\n        \"bg-muted flex h-9 flex-row items-center justify-center rounded-lg p-[3px]\",\n        Platform.select({ web: \"inline-flex w-fit\", native: \"mr-auto\" }),\n        className,\n      )}\n      {...props}\n    />\n  );\n}\n\nfunction TabsTrigger({\n  className,\n  ...props\n}: TabsPrimitive.TriggerProps & React.RefAttributes<TabsPrimitive.TriggerRef>) {\n  const { value } = TabsPrimitive.useRootContext();\n  return (\n    <TextClassContext.Provider\n      value={cn(\n        \"text-foreground dark:text-muted-foreground text-sm font-medium\",\n        value === props.value && \"dark:text-foreground\",\n      )}\n    >\n      <TabsPrimitive.Trigger\n        className={cn(\n          \"flex flex-row items-center justify-center gap-1.5 rounded-md border border-transparent px-2 py-1 shadow-none shadow-black/5\",\n          Platform.select({\n            web: \"focus-visible:border-ring focus-visible:ring-ring/50 focus-visible:outline-ring web:h-[calc(100%-1px)] inline-flex cursor-default whitespace-nowrap transition-[color,box-shadow] focus-visible:outline-1 focus-visible:ring-[3px] disabled:pointer-events-none [&_svg]:pointer-events-none [&_svg]:shrink-0\",\n          }),\n          props.disabled && \"opacity-50\",\n          props.value === value &&\n            \"bg-background dark:border-foreground/10 dark:bg-input/30\",\n          className,\n        )}\n        {...props}\n      />\n    </TextClassContext.Provider>\n  );\n}\n\nfunction TabsContent({\n  className,\n  ...props\n}: TabsPrimitive.ContentProps & React.RefAttributes<TabsPrimitive.ContentRef>) {\n  return (\n    <TabsPrimitive.Content\n      className={cn(Platform.select({ web: \"flex-1 outline-none\" }), className)}\n      {...props}\n    />\n  );\n}\n\nexport { Tabs, TabsContent, TabsList, TabsTrigger };\n"
    }
  ],
  "dependencies": {
    "@rn-primitives/tabs": "1.5.2",
    "react-native": "0.83.1"
  },
  "registryDependencies": [
    "text",
    "utils"
  ],
  "integrity": "sha256-kbhKOV2fMH72oGvs5ADKXhOz6vTJ/urXYc/uEw/Ioa0="
}
