{
  "$schema": "https://moe-ui.vercel.app/schema/registry-item.json",
  "schemaVersion": 1,
  "name": "switch",
  "title": "Switch",
  "description": "A control for toggling an immediate on or off setting.",
  "category": "form",
  "type": "registry:ui",
  "files": [
    {
      "path": "components/ui/switch.tsx",
      "target": "components/ui/switch.tsx",
      "content": "\"use client\";\n\nimport { cn } from \"../../lib/utils\";\nimport * as SwitchPrimitives from \"@rn-primitives/switch\";\nimport { Platform } from \"react-native\";\n\nfunction Switch({\n  className,\n  ...props\n}: SwitchPrimitives.RootProps & React.RefAttributes<SwitchPrimitives.RootRef>) {\n  return (\n    <SwitchPrimitives.Root\n      className={cn(\n        \"flex h-[1.15rem] w-8 shrink-0 flex-row items-center rounded-full border border-transparent shadow-sm shadow-black/5\",\n        Platform.select({\n          web: \"focus-visible:border-ring focus-visible:ring-ring/50 peer inline-flex outline-none transition-all focus-visible:ring-[3px] disabled:cursor-not-allowed\",\n        }),\n        props.checked ? \"bg-primary\" : \"bg-input dark:bg-input/80\",\n        props.disabled && \"opacity-50\",\n        className,\n      )}\n      {...props}\n    >\n      <SwitchPrimitives.Thumb\n        className={cn(\n          \"bg-background size-4 rounded-full transition-transform\",\n          Platform.select({\n            web: \"pointer-events-none block ring-0\",\n          }),\n          props.checked\n            ? \"dark:bg-primary-foreground translate-x-3.5\"\n            : \"dark:bg-foreground translate-x-0\",\n        )}\n      />\n    </SwitchPrimitives.Root>\n  );\n}\n\nexport { Switch };\n"
    }
  ],
  "dependencies": {
    "@rn-primitives/switch": "1.5.2",
    "react-native": "0.83.1"
  },
  "registryDependencies": [
    "utils"
  ],
  "integrity": "sha256-5sHrXCfhqmS7P4dHFN4ckD3ONeJwiBsuHIyWcY6IKW8="
}
