{
  "$schema": "https://moe-ui.vercel.app/schema/registry-item.json",
  "schemaVersion": 1,
  "name": "alert-dialog",
  "title": "Alert Dialog",
  "description": "A modal confirmation dialog that interrupts the user.",
  "category": "overlay",
  "type": "registry:ui",
  "files": [
    {
      "path": "components/ui/alert-dialog.tsx",
      "target": "components/ui/alert-dialog.tsx",
      "content": "import * as AlertDialogPrimitive from \"@rn-primitives/alert-dialog\";\nimport * as React from \"react\";\nimport { Platform, StyleSheet, View } from \"react-native\";\nimport Animated, { FadeIn, FadeOut } from \"react-native-reanimated\";\nimport { cn } from \"../../lib/utils\";\nimport { buttonTextVariants, buttonVariants } from \"./button\";\nimport { TextClassContext } from \"./text\";\n\nconst AlertDialog = AlertDialogPrimitive.Root;\nconst AlertDialogTrigger = AlertDialogPrimitive.Trigger;\nconst AlertDialogPortal = AlertDialogPrimitive.Portal;\n\nconst AlertDialogOverlay = React.forwardRef<\n  React.ElementRef<typeof AlertDialogPrimitive.Overlay>,\n  React.ComponentPropsWithoutRef<typeof AlertDialogPrimitive.Overlay>\n>(({ className, ...props }, ref) => {\n  return (\n    <AlertDialogPrimitive.Overlay\n      style={StyleSheet.absoluteFill}\n      className={cn(\n        \"z-50 flex items-center justify-center bg-black/80 p-2\",\n        className,\n      )}\n      {...props}\n      ref={ref}\n    >\n      <Animated.View\n        entering={FadeIn.duration(150)}\n        exiting={FadeOut.duration(150)}\n      >\n        {props.children}\n      </Animated.View>\n    </AlertDialogPrimitive.Overlay>\n  );\n});\nAlertDialogOverlay.displayName = \"AlertDialogOverlay\";\n\nconst AlertDialogContent = React.forwardRef<\n  React.ElementRef<typeof AlertDialogPrimitive.Content>,\n  React.ComponentPropsWithoutRef<typeof AlertDialogPrimitive.Content>\n>(({ className, ...props }, ref) => {\n  return (\n    <AlertDialogPortal>\n      <AlertDialogOverlay>\n        <AlertDialogPrimitive.Content\n          ref={ref}\n          className={cn(\n            \"z-50 max-w-lg gap-4 rounded-lg border border-border bg-background p-6 shadow-lg web:duration-200\",\n            className,\n          )}\n          {...props}\n        />\n      </AlertDialogOverlay>\n    </AlertDialogPortal>\n  );\n});\nAlertDialogContent.displayName = AlertDialogPrimitive.Content.displayName;\n\nconst AlertDialogHeader = ({\n  className,\n  ...props\n}: React.ComponentPropsWithoutRef<typeof View>) => (\n  <View className={cn(\"flex flex-col gap-2\", className)} {...props} />\n);\nAlertDialogHeader.displayName = \"AlertDialogHeader\";\n\nconst AlertDialogFooter = ({\n  className,\n  ...props\n}: React.ComponentPropsWithoutRef<typeof View>) => (\n  <View\n    className={cn(\n      \"flex flex-col-reverse gap-2 sm:flex-row sm:justify-end\",\n      className,\n    )}\n    {...props}\n  />\n);\nAlertDialogFooter.displayName = \"AlertDialogFooter\";\n\nconst AlertDialogTitle = React.forwardRef<\n  React.ElementRef<typeof AlertDialogPrimitive.Title>,\n  React.ComponentPropsWithoutRef<typeof AlertDialogPrimitive.Title>\n>(({ className, ...props }, ref) => (\n  <AlertDialogPrimitive.Title\n    ref={ref}\n    className={cn(\n      \"text-lg font-semibold text-foreground native:text-xl\",\n      className,\n    )}\n    {...props}\n  />\n));\nAlertDialogTitle.displayName = AlertDialogPrimitive.Title.displayName;\n\nconst AlertDialogDescription = React.forwardRef<\n  React.ElementRef<typeof AlertDialogPrimitive.Description>,\n  React.ComponentPropsWithoutRef<typeof AlertDialogPrimitive.Description>\n>(({ className, ...props }, ref) => (\n  <AlertDialogPrimitive.Description\n    ref={ref}\n    className={cn(\"text-sm text-muted-foreground native:text-base\", className)}\n    {...props}\n  />\n));\nAlertDialogDescription.displayName =\n  AlertDialogPrimitive.Description.displayName;\n\nconst AlertDialogAction = React.forwardRef<\n  React.ElementRef<typeof AlertDialogPrimitive.Action>,\n  React.ComponentPropsWithoutRef<typeof AlertDialogPrimitive.Action>\n>(({ className, ...props }, ref) => (\n  <TextClassContext.Provider value={buttonTextVariants({ className })}>\n    <AlertDialogPrimitive.Action\n      ref={ref}\n      className={cn(buttonVariants(), className)}\n      {...props}\n    />\n  </TextClassContext.Provider>\n));\nAlertDialogAction.displayName = AlertDialogPrimitive.Action.displayName;\n\nconst AlertDialogCancel = React.forwardRef<\n  React.ElementRef<typeof AlertDialogPrimitive.Cancel>,\n  React.ComponentPropsWithoutRef<typeof AlertDialogPrimitive.Cancel>\n>(({ className, ...props }, ref) => (\n  <TextClassContext.Provider\n    value={buttonTextVariants({ variant: \"outline\", className })}\n  >\n    <AlertDialogPrimitive.Cancel\n      ref={ref}\n      className={cn(\n        buttonVariants({ variant: \"outline\" }),\n        \"mt-2 sm:mt-0\",\n        className,\n      )}\n      {...props}\n    />\n  </TextClassContext.Provider>\n));\nAlertDialogCancel.displayName = AlertDialogPrimitive.Cancel.displayName;\n\nexport {\n  AlertDialog,\n  AlertDialogAction,\n  AlertDialogCancel,\n  AlertDialogContent,\n  AlertDialogDescription,\n  AlertDialogFooter,\n  AlertDialogHeader,\n  AlertDialogOverlay,\n  AlertDialogPortal,\n  AlertDialogTitle,\n  AlertDialogTrigger,\n};\n"
    }
  ],
  "dependencies": {
    "@rn-primitives/alert-dialog": "1.5.2",
    "react-native": "0.83.1",
    "react-native-reanimated": "4.2.1"
  },
  "registryDependencies": [
    "button",
    "text",
    "utils"
  ],
  "integrity": "sha256-nw2c8geOGB3mUJx0KOVnO7qL3Q+BLrHg7qtrb2UaSgU="
}
