{
  "$schema": "https://moe-ui.vercel.app/schema/registry-item.json",
  "schemaVersion": 1,
  "name": "progress",
  "title": "Progress",
  "description": "A visual indicator for task completion.",
  "category": "feedback",
  "type": "registry:ui",
  "files": [
    {
      "path": "components/ui/progress.tsx",
      "target": "components/ui/progress.tsx",
      "content": "import { cn } from \"../../lib/utils\";\nimport * as ProgressPrimitive from \"@rn-primitives/progress\";\nimport { Platform, View } from \"react-native\";\nimport Animated, {\n  Extrapolation,\n  interpolate,\n  useAnimatedStyle,\n  useDerivedValue,\n  withSpring,\n} from \"react-native-reanimated\";\n\nfunction Progress({\n  className,\n  value,\n  indicatorClassName,\n  ...props\n}: ProgressPrimitive.RootProps &\n  React.RefAttributes<ProgressPrimitive.RootRef> & {\n    indicatorClassName?: string;\n  }) {\n  return (\n    <ProgressPrimitive.Root\n      className={cn(\n        \"bg-primary/20 relative h-2 w-full overflow-hidden rounded-full\",\n        className,\n      )}\n      {...props}\n    >\n      <Indicator value={value} className={indicatorClassName} />\n    </ProgressPrimitive.Root>\n  );\n}\n\nexport { Progress };\n\nconst Indicator = Platform.select({\n  web: WebIndicator,\n  native: NativeIndicator,\n  default: NullIndicator,\n});\n\ntype IndicatorProps = {\n  value: number | undefined | null;\n  className?: string;\n};\n\nfunction WebIndicator({ value, className }: IndicatorProps) {\n  if (Platform.OS !== \"web\") {\n    return null;\n  }\n\n  return (\n    <View\n      className={cn(\n        \"bg-primary h-full w-full flex-1 transition-all\",\n        className,\n      )}\n      style={{ transform: `translateX(-${100 - (value ?? 0)}%)` }}\n    >\n      <ProgressPrimitive.Indicator className={cn(\"h-full w-full\", className)} />\n    </View>\n  );\n}\n\nfunction NativeIndicator({ value, className }: IndicatorProps) {\n  const progress = useDerivedValue(() => value ?? 0);\n\n  const indicator = useAnimatedStyle(() => {\n    return {\n      width: withSpring(\n        `${interpolate(progress.value, [0, 100], [1, 100], Extrapolation.CLAMP)}%`,\n        { overshootClamping: true },\n      ),\n    };\n  }, [value]);\n\n  if (Platform.OS === \"web\") {\n    return null;\n  }\n\n  return (\n    <ProgressPrimitive.Indicator asChild>\n      <Animated.View\n        style={indicator}\n        className={cn(\"bg-foreground h-full\", className)}\n      />\n    </ProgressPrimitive.Indicator>\n  );\n}\n\nfunction NullIndicator(_props: IndicatorProps) {\n  return null;\n}\n"
    }
  ],
  "dependencies": {
    "@rn-primitives/progress": "1.5.2",
    "react-native": "0.83.1",
    "react-native-reanimated": "4.2.1"
  },
  "registryDependencies": [
    "utils"
  ],
  "integrity": "sha256-pHCZkeKNQWoOXENNyimqCLDiO8BIHBp2F7DykpcWmDM="
}
