{
  "$schema": "https://moe-ui.vercel.app/schema/registry-item.json",
  "schemaVersion": 1,
  "name": "alert",
  "title": "Alert",
  "description": "A prominent message for important contextual information.",
  "category": "feedback",
  "type": "registry:ui",
  "files": [
    {
      "path": "components/ui/alert.tsx",
      "target": "components/ui/alert.tsx",
      "content": "import { Icon } from \"./icon\";\nimport { Text, TextClassContext } from \"./text\";\nimport { cn } from \"../../lib/utils\";\nimport type { LucideIcon } from \"lucide-react-native\";\nimport * as React from \"react\";\nimport { View, type ViewProps } from \"react-native\";\n\nfunction Alert({\n  className,\n  variant,\n  children,\n  icon,\n  iconClassName,\n  ...props\n}: ViewProps &\n  React.RefAttributes<View> & {\n    icon: LucideIcon;\n    variant?: \"default\" | \"destructive\";\n    iconClassName?: string;\n  }) {\n  return (\n    <TextClassContext.Provider\n      value={cn(\n        \"text-sm text-foreground\",\n        variant === \"destructive\" && \"text-destructive\",\n        className,\n      )}\n    >\n      <View\n        role=\"alert\"\n        className={cn(\n          \"bg-card border-border relative w-full rounded-lg border px-4 pb-2 pt-3.5\",\n          className,\n        )}\n        {...props}\n      >\n        <View className=\"absolute left-3.5 top-3\">\n          <Icon\n            as={icon}\n            className={cn(\n              \"size-4\",\n              variant === \"destructive\" && \"text-destructive\",\n              iconClassName,\n            )}\n          />\n        </View>\n        {children}\n      </View>\n    </TextClassContext.Provider>\n  );\n}\n\nfunction AlertTitle({\n  className,\n  ...props\n}: React.ComponentProps<typeof Text> & React.RefAttributes<Text>) {\n  return (\n    <Text\n      className={cn(\n        \"mb-1 ml-0.5 min-h-4 pl-6 font-medium leading-none tracking-tight\",\n        className,\n      )}\n      {...props}\n    />\n  );\n}\n\nfunction AlertDescription({\n  className,\n  ...props\n}: React.ComponentProps<typeof Text> & React.RefAttributes<Text>) {\n  const textClass = React.useContext(TextClassContext);\n  return (\n    <Text\n      className={cn(\n        \"text-muted-foreground ml-0.5 pb-1.5 pl-6 text-sm leading-relaxed\",\n        textClass?.includes(\"text-destructive\") && \"text-destructive/90\",\n        className,\n      )}\n      {...props}\n    />\n  );\n}\n\nexport { Alert, AlertDescription, AlertTitle };\n"
    }
  ],
  "dependencies": {
    "lucide-react-native": "0.563.0",
    "react-native": "0.83.1"
  },
  "registryDependencies": [
    "icon",
    "text",
    "utils"
  ],
  "integrity": "sha256-HRdh+Sj98Iv3smjjqtNUlumbgiSxEUtWWVgVj9hOQU0="
}
