{
  "$schema": "https://moe-ui.vercel.app/schema/registry-item.json",
  "schemaVersion": 1,
  "name": "hover-card",
  "title": "Hover Card",
  "description": "A preview card revealed by hover or keyboard focus.",
  "category": "overlay",
  "type": "registry:ui",
  "files": [
    {
      "path": "components/ui/hover-card.tsx",
      "target": "components/ui/hover-card.tsx",
      "content": "import * as HoverCardPrimitive from \"@rn-primitives/hover-card\";\nimport * as React from \"react\";\nimport { Platform, StyleSheet } from \"react-native\";\nimport Animated, { FadeIn, FadeOut } from \"react-native-reanimated\";\nimport { cn } from \"../../lib/utils\";\n\nconst HoverCard = HoverCardPrimitive.Root;\n\nconst HoverCardTrigger = HoverCardPrimitive.Trigger;\n\nconst HoverCardContent = React.forwardRef<\n  React.ElementRef<typeof HoverCardPrimitive.Content>,\n  React.ComponentPropsWithoutRef<typeof HoverCardPrimitive.Content>\n>(({ className, align = \"center\", sideOffset = 4, ...props }, ref) => {\n  return (\n    <HoverCardPrimitive.Portal>\n      <HoverCardPrimitive.Overlay\n        style={Platform.OS !== \"web\" ? StyleSheet.absoluteFill : undefined}\n      />\n      <HoverCardPrimitive.Content\n        ref={ref}\n        align={align}\n        sideOffset={sideOffset}\n        className={cn(\n          \"z-50 w-64 rounded-md border border-border bg-popover p-4 text-popover-foreground shadow-md outline-none web:data-[state=open]:animate-in web:data-[state=closed]:animate-out web:data-[state=closed]:fade-out-0 web:data-[state=open]:fade-in-0 web:data-[state=closed]:zoom-out-95 web:data-[state=open]:zoom-in-95 data-[side=bottom]:slide-in-from-top-2 data-[side=left]:slide-in-from-right-2 data-[side=right]:slide-in-from-left-2 data-[side=top]:slide-in-from-bottom-2\",\n          className,\n        )}\n        {...props}\n      >\n        {props.children}\n      </HoverCardPrimitive.Content>\n    </HoverCardPrimitive.Portal>\n  );\n});\nHoverCardContent.displayName = HoverCardPrimitive.Content.displayName;\n\nexport { HoverCard, HoverCardContent, HoverCardTrigger };\n"
    }
  ],
  "dependencies": {
    "@rn-primitives/hover-card": "1.5.2",
    "react-native": "0.83.1",
    "react-native-reanimated": "4.2.1"
  },
  "registryDependencies": [
    "utils"
  ],
  "integrity": "sha256-OcCvUiCJbRxbjqUZME81BvQh93xEhk2/G5bRAtLpzFw="
}
