{
  "$schema": "https://moe-ui-docs.vercel.app/schema/registry-item.json",
  "schemaVersion": 1,
  "name": "checkbox",
  "title": "Checkbox",
  "description": "A control for toggling a boolean choice.",
  "category": "form",
  "type": "registry:ui",
  "files": [
    {
      "path": "components/ui/checkbox.tsx",
      "target": "components/ui/checkbox.tsx",
      "content": "\"use client\";\n\nimport { Icon } from \"./icon\";\nimport { cn } from \"../../lib/utils\";\nimport * as CheckboxPrimitive from \"@rn-primitives/checkbox\";\nimport { Check } from \"lucide-react-native\";\nimport * as React from \"react\";\nimport { Platform } from \"react-native\";\n\nconst DEFAULT_HIT_SLOP = 24;\n\nfunction Checkbox({\n  className,\n  checkedClassName,\n  indicatorClassName,\n  iconClassName,\n  checked: checkedProp,\n  defaultChecked = false,\n  onCheckedChange,\n  ...props\n}: Omit<CheckboxPrimitive.RootProps, \"checked\" | \"onCheckedChange\"> &\n  React.RefAttributes<CheckboxPrimitive.RootRef> & {\n    checked?: boolean;\n    defaultChecked?: boolean;\n    onCheckedChange?: (checked: boolean) => void;\n    checkedClassName?: string;\n    indicatorClassName?: string;\n    iconClassName?: string;\n  }) {\n  const [uncontrolledChecked, setUncontrolledChecked] =\n    React.useState(defaultChecked);\n  const checked = checkedProp ?? uncontrolledChecked;\n\n  return (\n    <CheckboxPrimitive.Root\n      className={cn(\n        \"border-input dark:bg-input/30 size-4 shrink-0 rounded-[4px] border shadow-sm shadow-black/5\",\n        Platform.select({\n          web: \"focus-visible:border-ring focus-visible:ring-ring/50 aria-invalid:ring-destructive/20 dark:aria-invalid:ring-destructive/40 aria-invalid:border-destructive peer cursor-default outline-none transition-shadow focus-visible:ring-[3px] disabled:cursor-not-allowed\",\n          native: \"overflow-hidden\",\n        }),\n        checked && cn(\"border-primary\", checkedClassName),\n        props.disabled && \"opacity-50\",\n        className,\n      )}\n      hitSlop={DEFAULT_HIT_SLOP}\n      checked={checked}\n      onCheckedChange={(nextChecked) => {\n        if (checkedProp === undefined) setUncontrolledChecked(nextChecked);\n        onCheckedChange?.(nextChecked);\n      }}\n      {...props}\n    >\n      <CheckboxPrimitive.Indicator\n        className={cn(\n          \"bg-primary h-full w-full items-center justify-center\",\n          indicatorClassName,\n        )}\n      >\n        <Icon\n          as={Check}\n          size={12}\n          strokeWidth={Platform.OS === \"web\" ? 2.5 : 3.5}\n          className={cn(\"text-primary-foreground\", iconClassName)}\n        />\n      </CheckboxPrimitive.Indicator>\n    </CheckboxPrimitive.Root>\n  );\n}\n\nexport { Checkbox };\n"
    }
  ],
  "dependencies": {
    "@rn-primitives/checkbox": "1.5.2",
    "lucide-react-native": "0.563.0",
    "react-native": "0.83.1"
  },
  "registryDependencies": [
    "icon",
    "utils"
  ],
  "integrity": "sha256-69IhYmUhlKgt+fm+wl1zK89ZXETBLI2+v9NqO6jWkwg="
}
