{
  "$schema": "https://moe-ui.vercel.app/schema/registry-item.json",
  "schemaVersion": 1,
  "name": "toggle",
  "title": "Toggle",
  "description": "A two-state button that can be on or off.",
  "category": "form",
  "type": "registry:ui",
  "files": [
    {
      "path": "components/ui/toggle.tsx",
      "target": "components/ui/toggle.tsx",
      "content": "import { Icon } from \"./icon\";\nimport { TextClassContext } from \"./text\";\nimport { cn } from \"../../lib/utils\";\nimport * as TogglePrimitive from \"@rn-primitives/toggle\";\nimport { cva, type VariantProps } from \"class-variance-authority\";\nimport * as React from \"react\";\nimport { Platform } from \"react-native\";\n\nconst toggleVariants = cva(\n  cn(\n    \"active:bg-muted group flex flex-row items-center justify-center gap-2 rounded-md\",\n    Platform.select({\n      web: \"hover:bg-muted hover:text-muted-foreground focus-visible:border-ring focus-visible:ring-ring/50 aria-invalid:ring-destructive/20 dark:aria-invalid:ring-destructive/40 aria-invalid:border-destructive inline-flex cursor-default whitespace-nowrap outline-none transition-[color,box-shadow] focus-visible:ring-[3px] disabled:pointer-events-none [&_svg]:pointer-events-none\",\n    }),\n  ),\n  {\n    variants: {\n      variant: {\n        default: \"bg-transparent\",\n        outline: cn(\n          \"border-input active:bg-accent border bg-transparent shadow-sm shadow-black/5\",\n          Platform.select({\n            web: \"hover:bg-accent hover:text-accent-foreground\",\n          }),\n        ),\n      },\n      size: {\n        default: \"h-10 min-w-10 px-2.5 sm:h-9 sm:min-w-9 sm:px-2\",\n        sm: \"h-9 min-w-9 px-2 sm:h-8 sm:min-w-8 sm:px-1.5\",\n        lg: \"h-11 min-w-11 px-3 sm:h-10 sm:min-w-10 sm:px-2.5\",\n      },\n    },\n    defaultVariants: {\n      variant: \"default\",\n      size: \"default\",\n    },\n  },\n);\n\nfunction Toggle({\n  className,\n  variant,\n  size,\n  pressed: pressedProp,\n  defaultPressed = false,\n  onPressedChange,\n  ...props\n}: Omit<TogglePrimitive.RootProps, \"pressed\" | \"onPressedChange\"> &\n  VariantProps<typeof toggleVariants> &\n  React.RefAttributes<TogglePrimitive.RootRef> & {\n    pressed?: boolean;\n    defaultPressed?: boolean;\n    onPressedChange?: (pressed: boolean) => void;\n  }) {\n  const [uncontrolledPressed, setUncontrolledPressed] = React.useState(defaultPressed);\n  const pressed = pressedProp ?? uncontrolledPressed;\n  return (\n    <TextClassContext.Provider\n      value={cn(\n        \"text-sm text-foreground font-medium\",\n        pressed\n          ? \"text-accent-foreground\"\n          : Platform.select({ web: \"group-hover:text-muted-foreground\" }),\n        className,\n      )}\n    >\n      <TogglePrimitive.Root\n        className={cn(\n          toggleVariants({ variant, size }),\n          props.disabled && \"opacity-50\",\n          pressed && \"bg-accent\",\n          className,\n        )}\n        pressed={pressed}\n        onPressedChange={(nextPressed) => {\n          if (pressedProp === undefined) setUncontrolledPressed(nextPressed);\n          onPressedChange?.(nextPressed);\n        }}\n        {...props}\n      />\n    </TextClassContext.Provider>\n  );\n}\n\nfunction ToggleIcon({\n  className,\n  ...props\n}: React.ComponentProps<typeof Icon>) {\n  const textClass = React.useContext(TextClassContext);\n  return (\n    <Icon className={cn(\"size-4 shrink-0\", textClass, className)} {...props} />\n  );\n}\n\nexport { Toggle, ToggleIcon, toggleVariants };\n"
    }
  ],
  "dependencies": {
    "@rn-primitives/toggle": "1.5.2",
    "class-variance-authority": "^0.7.1",
    "react-native": "0.83.1"
  },
  "registryDependencies": [
    "icon",
    "text",
    "utils"
  ],
  "integrity": "sha256-AQ8ofjQi/k2onFe2uksZzCSxsDVXXViVjxsoJI2i3YY="
}
