{
  "$schema": "https://moe-ui.vercel.app/schema/registry-item.json",
  "schemaVersion": 1,
  "name": "label",
  "title": "Label",
  "description": "An accessible label associated with a form control.",
  "category": "form",
  "type": "registry:ui",
  "files": [
    {
      "path": "components/ui/label.tsx",
      "target": "components/ui/label.tsx",
      "content": "import { cn } from \"../../lib/utils\";\nimport * as LabelPrimitive from \"@rn-primitives/label\";\nimport { Platform } from \"react-native\";\n\nfunction Label({\n  className,\n  onPress,\n  onLongPress,\n  onPressIn,\n  onPressOut,\n  disabled,\n  ...props\n}: LabelPrimitive.TextProps & React.RefAttributes<LabelPrimitive.TextRef>) {\n  return (\n    <LabelPrimitive.Root\n      className={cn(\n        \"flex select-none flex-row items-center gap-2\",\n        Platform.select({\n          web: \"cursor-default leading-none peer-disabled:cursor-not-allowed peer-disabled:opacity-50 group-data-[disabled=true]:pointer-events-none group-data-[disabled=true]:opacity-50\",\n        }),\n        disabled && \"opacity-50\",\n      )}\n      onPress={onPress}\n      onLongPress={onLongPress}\n      onPressIn={onPressIn}\n      onPressOut={onPressOut}\n      disabled={disabled}\n    >\n      <LabelPrimitive.Text\n        className={cn(\n          \"text-foreground text-sm font-medium\",\n          Platform.select({ web: \"leading-none\" }),\n          className,\n        )}\n        {...props}\n      />\n    </LabelPrimitive.Root>\n  );\n}\n\nexport { Label };\n"
    }
  ],
  "dependencies": {
    "@rn-primitives/label": "1.5.2",
    "react-native": "0.83.1"
  },
  "registryDependencies": [
    "utils"
  ],
  "integrity": "sha256-seqwWv2Z0S26LSFcr+xK/FPgfPlylRYxLj0AxH0Q0k8="
}
