{
  "$schema": "https://moe-ui.vercel.app/schema/registry-item.json",
  "schemaVersion": 1,
  "name": "native-only-animated-view",
  "title": "Native-only Animated View",
  "description": "Animation compatibility helper.",
  "category": "internal",
  "type": "registry:ui",
  "files": [
    {
      "path": "components/ui/native-only-animated-view.tsx",
      "target": "components/ui/native-only-animated-view.tsx",
      "content": "\"use client\";\n\nimport { Platform } from \"react-native\";\nimport Animated from \"react-native-reanimated\";\n\n/**\n * This component is used to wrap animated views that should only be animated on native.\n * @param props - The props for the animated view.\n * @returns The animated view if the platform is native, otherwise the children.\n * @example\n * <NativeOnlyAnimatedView entering={FadeIn} exiting={FadeOut}>\n *   <Text>I am only animated on native</Text>\n * </NativeOnlyAnimatedView>\n */\nfunction NativeOnlyAnimatedView(\n  props: React.ComponentProps<typeof Animated.View> &\n    React.RefAttributes<Animated.View>,\n) {\n  if (Platform.OS === \"web\") {\n    return <>{props.children as React.ReactNode}</>;\n  } else {\n    return <Animated.View {...props} />;\n  }\n}\n\nexport { NativeOnlyAnimatedView };\n"
    }
  ],
  "dependencies": {
    "react-native": "0.83.1",
    "react-native-reanimated": "4.2.1"
  },
  "registryDependencies": [],
  "integrity": "sha256-CacG/Rz8A40xv7FDTwo7PIiDHkBjqStNb5pHZm0irOY="
}
