{
  "$schema": "https://moe-ui.vercel.app/schema/registry-item.json",
  "schemaVersion": 1,
  "name": "sheet",
  "title": "Sheet",
  "description": "A dialog that slides from an edge of the viewport.",
  "category": "overlay",
  "type": "registry:ui",
  "files": [
    {
      "path": "components/ui/sheet.tsx",
      "target": "components/ui/sheet.tsx",
      "content": "import * as SheetPrimitive from \"@rn-primitives/dialog\";\nimport * as React from \"react\";\nimport { StyleSheet, View } from \"react-native\";\nimport Animated, { FadeIn, FadeOut } from \"react-native-reanimated\";\nimport { X } from \"lucide-react-native\";\nimport { cn } from \"../../lib/utils\";\n\nconst Sheet = SheetPrimitive.Root;\n\nconst SheetTrigger = SheetPrimitive.Trigger;\n\nconst SheetClose = SheetPrimitive.Close;\n\nconst SheetPortal = SheetPrimitive.Portal;\n\nconst SheetOverlay = React.forwardRef<\n  React.ElementRef<typeof SheetPrimitive.Overlay>,\n  React.ComponentPropsWithoutRef<typeof SheetPrimitive.Overlay>\n>(({ className, ...props }, ref) => {\n  return (\n    <SheetPrimitive.Overlay\n      style={StyleSheet.absoluteFill}\n      className={cn(\n        \"z-50 bg-black/80 flex justify-center items-center p-2\",\n        className,\n      )}\n      {...props}\n      ref={ref}\n    >\n      <Animated.View\n        entering={FadeIn.duration(150)}\n        exiting={FadeOut.duration(150)}\n      />\n    </SheetPrimitive.Overlay>\n  );\n});\nSheetOverlay.displayName = SheetPrimitive.Overlay.displayName;\n\nconst SheetContent = React.forwardRef<\n  React.ElementRef<typeof SheetPrimitive.Content>,\n  React.ComponentPropsWithoutRef<typeof SheetPrimitive.Content> & {\n    portalHost?: string;\n    side?: \"top\" | \"bottom\" | \"left\" | \"right\";\n  }\n>(({ className, children, portalHost, side = \"right\", ...props }, ref) => {\n  return (\n    <SheetPortal hostName={portalHost}>\n      <SheetOverlay>\n        <SheetPrimitive.Content\n          ref={ref}\n          className={cn(\n            \"z-50 gap-4 border-l border-border bg-background p-6 shadow-lg web:cursor-default absolute h-full w-3/4  sm:max-w-sm\",\n            side === \"right\" && \"right-0 top-0 border-l\",\n            side === \"bottom\" && \"bottom-0 left-0 right-0 border-t h-auto\",\n            className,\n          )}\n          {...props}\n        >\n          {children}\n          <SheetPrimitive.Close\n            className={\n              \"absolute right-4 top-4 rounded-sm opacity-70 ring-offset-background transition-opacity hover:opacity-100 focus:outline-none focus:ring-2 focus:ring-ring focus:ring-offset-2 disabled:pointer-events-none data-[state=open]:bg-secondary\"\n            }\n          >\n            <X size={18} className=\"text-muted-foreground\" />\n            <span className=\"sr-only\">Close</span>\n          </SheetPrimitive.Close>\n        </SheetPrimitive.Content>\n      </SheetOverlay>\n    </SheetPortal>\n  );\n});\nSheetContent.displayName = SheetPrimitive.Content.displayName;\n\nconst SheetHeader = ({\n  className,\n  ...props\n}: React.ComponentPropsWithoutRef<typeof View>) => (\n  <View\n    className={cn(\n      \"flex flex-col space-y-2 text-center sm:text-left\",\n      className,\n    )}\n    {...props}\n  />\n);\nSheetHeader.displayName = \"SheetHeader\";\n\nconst SheetFooter = ({\n  className,\n  ...props\n}: React.ComponentPropsWithoutRef<typeof View>) => (\n  <View\n    className={cn(\n      \"flex flex-col-reverse sm:flex-row sm:justify-end sm:space-x-2\",\n      className,\n    )}\n    {...props}\n  />\n);\nSheetFooter.displayName = \"SheetFooter\";\n\nconst SheetTitle = React.forwardRef<\n  React.ElementRef<typeof SheetPrimitive.Title>,\n  React.ComponentPropsWithoutRef<typeof SheetPrimitive.Title>\n>(({ className, ...props }, ref) => (\n  <SheetPrimitive.Title\n    ref={ref}\n    className={cn(\"text-lg font-semibold text-foreground\", className)}\n    {...props}\n  />\n));\nSheetTitle.displayName = SheetPrimitive.Title.displayName;\n\nconst SheetDescription = React.forwardRef<\n  React.ElementRef<typeof SheetPrimitive.Description>,\n  React.ComponentPropsWithoutRef<typeof SheetPrimitive.Description>\n>(({ className, ...props }, ref) => (\n  <SheetPrimitive.Description\n    ref={ref}\n    className={cn(\"text-sm text-muted-foreground\", className)}\n    {...props}\n  />\n));\nSheetDescription.displayName = SheetPrimitive.Description.displayName;\n\nexport {\n  Sheet,\n  SheetClose,\n  SheetContent,\n  SheetDescription,\n  SheetFooter,\n  SheetHeader,\n  SheetOverlay,\n  SheetPortal,\n  SheetTitle,\n  SheetTrigger,\n};\n"
    }
  ],
  "dependencies": {
    "@rn-primitives/dialog": "1.5.2",
    "lucide-react-native": "0.563.0",
    "react-native": "0.83.1",
    "react-native-reanimated": "4.2.1"
  },
  "registryDependencies": [
    "utils"
  ],
  "integrity": "sha256-oAu17W8iMIBpdFcFdYDfmE8g270OxfMtbMzAhq3dSxo="
}
