{
  "$schema": "https://moe-ui.vercel.app/schema/registry-item.json",
  "schemaVersion": 1,
  "name": "icon",
  "title": "Icon",
  "description": "Styling-engine-aware Lucide icon helper.",
  "category": "internal",
  "type": "registry:ui",
  "files": [
    {
      "path": "components/ui/icon.tsx",
      "target": "components/ui/icon.tsx",
      "content": "\"use client\";\n\nimport type { LucideIcon, LucideProps } from \"lucide-react-native\";\nimport { withMoeIcon } from \"../../lib/moe-ui-styling\";\nimport { cn } from \"../../lib/utils\";\n\ntype IconProps = LucideProps & {\n  as: LucideIcon;\n};\n\nfunction IconImpl({ as: IconComponent, ...props }: IconProps) {\n  return <IconComponent {...props} />;\n}\n\nconst StyledIcon = withMoeIcon(IconImpl);\n\n/**\n * A wrapper component for Lucide icons with styling-engine-aware `className` support.\n *\n * This component allows you to render any Lucide icon while applying utility classes\n * using the engine selected during Moe UI initialization.\n *\n * @component\n * @example\n * ```tsx\n * import { ArrowRight } from 'lucide-react-native';\n * import { Icon } from '@/registry/components/ui/icon';\n *\n * <Icon as={ArrowRight} className=\"text-red-500 size-4\" />\n * ```\n *\n * @param {LucideIcon} as - The Lucide icon component to render.\n * @param {string} className - Utility classes to style the icon.\n * @param {number} size - Icon size (overrides the size class).\n * @param {...LucideProps} ...props - Additional Lucide icon props passed to the \"as\" icon.\n */\nfunction Icon({ as: IconComponent, className, ...props }: IconProps) {\n  return (\n    <StyledIcon\n      as={IconComponent}\n      className={cn(\"text-foreground size-5\", className)}\n      {...props}\n    />\n  );\n}\n\nexport { Icon };\n"
    }
  ],
  "dependencies": {
    "lucide-react-native": "0.563.0"
  },
  "registryDependencies": [
    "utils"
  ],
  "integrity": "sha256-HYQy+3JGleRbneXqvkNWiYy8DQqi1LnqrTosrymi/p0="
}
