{
  "$schema": "https://moe-ui.vercel.app/schema/registry-item.json",
  "schemaVersion": 1,
  "name": "aspect-ratio",
  "title": "Aspect Ratio",
  "description": "Keeps content within a consistent aspect ratio.",
  "category": "media",
  "type": "registry:ui",
  "files": [
    {
      "path": "components/ui/aspect-ratio.tsx",
      "target": "components/ui/aspect-ratio.tsx",
      "content": "import * as AspectRatioPrimitive from \"@rn-primitives/aspect-ratio\";\n\nconst AspectRatio = AspectRatioPrimitive.Root;\n\nexport { AspectRatio };\n"
    }
  ],
  "dependencies": {
    "@rn-primitives/aspect-ratio": "1.5.2"
  },
  "registryDependencies": [],
  "integrity": "sha256-GR2GWrkuEeap8oOLp0jJxUrWX1Z1VfAwHvnlqCQktKI="
}
