{
  "$schema": "https://moe-ui.vercel.app/schema/registry-item.json",
  "schemaVersion": 1,
  "name": "textarea",
  "title": "Textarea",
  "description": "A styled multiline text input.",
  "category": "form",
  "type": "registry:ui",
  "files": [
    {
      "path": "components/ui/textarea.tsx",
      "target": "components/ui/textarea.tsx",
      "content": "import { cn } from \"../../lib/utils\";\nimport { Platform, TextInput, type TextInputProps } from \"react-native\";\n\nfunction Textarea({\n  className,\n  multiline = true,\n  numberOfLines = Platform.select({ web: 2, native: 8 }), // On web, numberOfLines also determines initial height. On native, it determines the maximum height.\n  placeholderClassName,\n  ...props\n}: TextInputProps & React.RefAttributes<TextInput>) {\n  return (\n    <TextInput\n      className={cn(\n        \"text-foreground border-input dark:bg-input/30 flex min-h-16 w-full flex-row rounded-md border bg-transparent px-3 py-2 text-base shadow-sm shadow-black/5 md:text-sm\",\n        Platform.select({\n          web: \"placeholder:text-muted-foreground focus-visible:border-ring focus-visible:ring-ring/50 aria-invalid:ring-destructive/20 dark:aria-invalid:ring-destructive/40 aria-invalid:border-destructive field-sizing-content resize-y outline-none transition-[color,box-shadow] focus-visible:ring-[3px] disabled:cursor-not-allowed\",\n        }),\n        props.editable === false && \"opacity-50\",\n        className,\n      )}\n      placeholderClassName={cn(\"text-muted-foreground\", placeholderClassName)}\n      multiline={multiline}\n      numberOfLines={numberOfLines}\n      textAlignVertical=\"top\"\n      {...props}\n    />\n  );\n}\n\nexport { Textarea };\n"
    }
  ],
  "dependencies": {
    "react-native": "0.83.1"
  },
  "registryDependencies": [
    "utils"
  ],
  "integrity": "sha256-xszyZH6LGVDCBkb3vy/braH+mIHYmPKaZB8a/nyS3X8="
}
