{
  "$schema": "https://moe-ui-docs.vercel.app/schema/registry-item.json",
  "schemaVersion": 1,
  "name": "toggle-group",
  "title": "Toggle Group",
  "description": "A coordinated set of single or multiple toggles.",
  "category": "form",
  "type": "registry:ui",
  "files": [
    {
      "path": "components/ui/toggle-group.tsx",
      "target": "components/ui/toggle-group.tsx",
      "content": "\"use client\";\n\nimport { Icon } from \"./icon\";\nimport { TextClassContext } from \"./text\";\nimport { toggleVariants } from \"./toggle\";\nimport { cn } from \"../../lib/utils\";\nimport * as ToggleGroupPrimitive from \"@rn-primitives/toggle-group\";\nimport type { VariantProps } from \"class-variance-authority\";\nimport * as React from \"react\";\nimport { Platform } from \"react-native\";\n\nconst ToggleGroupContext = React.createContext<VariantProps<\n  typeof toggleVariants\n> | null>(null);\n\nfunction ToggleGroup({\n  className,\n  variant,\n  size,\n  children,\n  ...props\n}: ToggleGroupPrimitive.RootProps &\n  VariantProps<typeof toggleVariants> &\n  React.RefAttributes<ToggleGroupPrimitive.RootRef>) {\n  return (\n    <ToggleGroupPrimitive.Root\n      className={cn(\n        \"flex flex-row items-center rounded-md shadow-none\",\n        Platform.select({ web: \"w-fit\" }),\n        variant === \"outline\" && \"shadow-sm shadow-black/5\",\n        className,\n      )}\n      {...props}\n    >\n      <ToggleGroupContext.Provider value={{ variant, size }}>\n        {children}\n      </ToggleGroupContext.Provider>\n    </ToggleGroupPrimitive.Root>\n  );\n}\n\nfunction useToggleGroupContext() {\n  const context = React.useContext(ToggleGroupContext);\n  if (context === null) {\n    throw new Error(\n      \"ToggleGroup compound components cannot be rendered outside the ToggleGroup component\",\n    );\n  }\n  return context;\n}\n\nfunction ToggleGroupItem({\n  className,\n  children,\n  variant,\n  size,\n  isFirst,\n  isLast,\n  ...props\n}: ToggleGroupPrimitive.ItemProps &\n  VariantProps<typeof toggleVariants> &\n  React.RefAttributes<ToggleGroupPrimitive.ItemRef> & {\n    isFirst?: boolean;\n    isLast?: boolean;\n  }) {\n  const context = useToggleGroupContext();\n  const { value } = ToggleGroupPrimitive.useRootContext();\n\n  return (\n    <TextClassContext.Provider\n      value={cn(\n        \"text-sm text-foreground font-medium\",\n        ToggleGroupPrimitive.utils.getIsSelected(value, props.value)\n          ? \"text-accent-foreground\"\n          : Platform.select({ web: \"group-hover:text-muted-foreground\" }),\n      )}\n    >\n      <ToggleGroupPrimitive.Item\n        className={cn(\n          toggleVariants({\n            variant: context.variant || variant,\n            size: context.size || size,\n          }),\n          props.disabled && \"opacity-50\",\n          ToggleGroupPrimitive.utils.getIsSelected(value, props.value) &&\n            \"bg-accent\",\n          \"min-w-0 shrink-0 rounded-none shadow-none\",\n          isFirst && \"rounded-l-md\",\n          isLast && \"rounded-r-md\",\n          (context.variant === \"outline\" || variant === \"outline\") &&\n            \"border-l-0\",\n          (context.variant === \"outline\" || variant === \"outline\") &&\n            isFirst &&\n            \"border-l\",\n          Platform.select({\n            web: \"flex-1 focus:z-10 focus-visible:z-10\",\n          }),\n          className,\n        )}\n        {...props}\n      >\n        {children}\n      </ToggleGroupPrimitive.Item>\n    </TextClassContext.Provider>\n  );\n}\n\nfunction ToggleGroupIcon({\n  className,\n  ...props\n}: React.ComponentProps<typeof Icon>) {\n  const textClass = React.useContext(TextClassContext);\n  return (\n    <Icon className={cn(\"size-4 shrink-0\", textClass, className)} {...props} />\n  );\n}\n\nexport { ToggleGroup, ToggleGroupIcon, ToggleGroupItem };\n"
    }
  ],
  "dependencies": {
    "@rn-primitives/toggle-group": "1.5.2",
    "class-variance-authority": "^0.7.1",
    "react-native": "0.83.1"
  },
  "registryDependencies": [
    "icon",
    "text",
    "toggle",
    "utils"
  ],
  "integrity": "sha256-OslyLtkvjLUM8x8HydMQuhyHH6Yg4CpKuNf6OB5O6Ic="
}
