{
  "$schema": "https://moe-ui-docs.vercel.app/schema/registry-item.json",
  "schemaVersion": 1,
  "name": "utils",
  "title": "Utilities",
  "description": "Class-name composition utility.",
  "category": "internal",
  "type": "registry:lib",
  "files": [
    {
      "path": "lib/utils.ts",
      "target": "lib/utils.ts",
      "content": "export { twMerge as cn } from \"tailwind-merge\";\n"
    }
  ],
  "dependencies": {
    "tailwind-merge": "^3.5.0"
  },
  "registryDependencies": [],
  "integrity": "sha256-zNX3lj2MKzTMGgF3pPYcjBK689eolGtZJ/SKWnNrjb0="
}
