{
  "$schema": "https://moe-ui.vercel.app/schema/registry-item.json",
  "schemaVersion": 1,
  "name": "popover",
  "title": "Popover",
  "description": "Floating content anchored to an interactive trigger.",
  "category": "overlay",
  "type": "registry:ui",
  "files": [
    {
      "path": "components/ui/popover.tsx",
      "target": "components/ui/popover.tsx",
      "content": "\"use client\";\n\nimport { NativeOnlyAnimatedView } from \"./native-only-animated-view\";\nimport { TextClassContext } from \"./text\";\nimport { cn } from \"../../lib/utils\";\nimport * as PopoverPrimitive from \"@rn-primitives/popover\";\nimport * as React from \"react\";\nimport { Platform, StyleSheet } from \"react-native\";\nimport { FadeIn, FadeOut } from \"react-native-reanimated\";\nimport { FullWindowOverlay as RNFullWindowOverlay } from \"react-native-screens\";\n\nconst Popover = PopoverPrimitive.Root;\n\nconst PopoverTrigger = PopoverPrimitive.Trigger;\n\nconst FullWindowOverlay =\n  Platform.OS === \"ios\" ? RNFullWindowOverlay : React.Fragment;\n\nfunction PopoverContent({\n  className,\n  align = \"center\",\n  sideOffset = 4,\n  portalHost,\n  ...props\n}: PopoverPrimitive.ContentProps &\n  React.RefAttributes<PopoverPrimitive.ContentRef> & {\n    portalHost?: string;\n  }) {\n  return (\n    <PopoverPrimitive.Portal hostName={portalHost}>\n      <FullWindowOverlay>\n        <PopoverPrimitive.Overlay\n          style={Platform.select({ native: StyleSheet.absoluteFill })}\n        >\n          <NativeOnlyAnimatedView\n            entering={FadeIn.duration(200)}\n            exiting={FadeOut}\n          >\n            <TextClassContext.Provider value=\"text-popover-foreground\">\n              <PopoverPrimitive.Content\n                align={align}\n                sideOffset={sideOffset}\n                className={cn(\n                  \"bg-popover border-border outline-none z-50 w-72 rounded-md border p-4 shadow-md shadow-black/5\",\n                  Platform.select({\n                    web: cn(\n                      \"animate-in fade-in-0 zoom-in-95 origin-[var(--radix-popover-content-transform-origin)] cursor-auto\",\n                      props.side === \"bottom\" && \"slide-in-from-top-2\",\n                      props.side === \"top\" && \"slide-in-from-bottom-2\",\n                    ),\n                  }),\n                  className,\n                )}\n                {...props}\n              />\n            </TextClassContext.Provider>\n          </NativeOnlyAnimatedView>\n        </PopoverPrimitive.Overlay>\n      </FullWindowOverlay>\n    </PopoverPrimitive.Portal>\n  );\n}\n\nexport { Popover, PopoverContent, PopoverTrigger };\n"
    }
  ],
  "dependencies": {
    "@rn-primitives/popover": "1.5.2",
    "react-native": "0.83.1",
    "react-native-reanimated": "4.2.1",
    "react-native-screens": "^4.27.0"
  },
  "registryDependencies": [
    "native-only-animated-view",
    "text",
    "utils"
  ],
  "integrity": "sha256-yjYyY1zqai6JuOXVfn2ot1zV5fh6+gTGekWLIsQxWCU="
}
